job_id,job_title,job_description_clean,skills,salary_usd,salary_currency,experience_level,employment_type,company_location,company_size,employee_residence,remote_ratio,required_skills,education_required,years_experience,industry,posting_date,application_deadline,job_description_length,benefits_score,company_name
402,digital trust & ethics specialist,ensures that automated systems and ai models remain fair transparent and compliant with organizational and legal ethics,"['ai ethics', 'explainable ai', 'data privacy', 'bias detection', 'transparency standards', 'regulatory compliance', 'audit', 'digital trust frameworks']",,,,,,,,,,,,,,,,,
403,sustainability data analyst,collects and analyzes environmental data to track an organization's carbon footprint and reporting metrics while identifying areas for efficiency improvements,"['carbon accounting', 'data analysis', 'ghg protocol', 'esg reporting', 'power bi', 'excel', 'sustainability frameworks', 'life cycle assessment', 'sql']",,,,,,,,,,,,,,,,,
404,renewable energy engineer,designs and implements sustainable energy systems such as solar and wind power while optimizing energy yield and ensuring grid integration,"['solar energy', 'wind energy', 'energy systems engineering', 'electrical engineering', 'grid integration', 'renewable technology', 'autocad', 'project management']",,,,,,,,,,,,,,,,,
405,ev infrastructure specialist,manages the design and deployment of electric vehicle charging networks while overseeing installation and maintenance of charging stations,"['ev charging technology', 'electrical infrastructure', 'project management', 'energy management', 'networking', 'regulatory compliance', 'smart grids']",,,,,,,,,,,,,,,,,
406,circular economy manager,develops and implements strategies to minimize waste and promote resource efficiency by designing products and systems for reuse and recycling,"['circular economy', 'waste management', 'supply chain management', 'resource efficiency', 'product design', 'sustainability strategy', 'lifecycle analysis']",,,,,,,,,,,,,,,,,
407,carbon footprint auditor,conducts formal assessments of greenhouse gas emissions to ensure compliance with international standards and regulatory reporting requirements,"['carbon auditing', 'iso 14064', 'ghg protocol', 'environmental auditing', 'data verification', 'compliance', 'sustainability reporting']",,,,,,,,,,,,,,,,,
408,climate change consultant,advises organizations on climate risk mitigation and adaptation strategies while developing plans to achieve net-zero targets and sustainability goals,"['climate risk assessment', 'decarbonization planning', 'sustainability strategy', 'policy analysis', 'stakeholder engagement', 'climate modeling', 'esg']",,,,,,,,,,,,,,,,,
409,solar project manager,oversees the planning and execution of solar energy projects from site assessment to commissioning while managing budgets and multidisciplinary teams,"['solar pv systems', 'project management', 'site assessment', 'budgeting', 'contract management', 'renewable energy regulations', 'nabcep']",,,,,,,,,,,,,,,,,
410,renewable energy consultant,evaluates energy needs and identifies suitable renewable solutions for clients while conducting feasibility studies and roi analyses,"['energy auditing', 'feasibility studies', 'renewable energy technology', 'financial analysis', 'policy advisory', 'client training', 'sustainability standards']",,,,,,,,,,,,,,,,,
411,green building architect,designs energy-efficient and sustainable buildings using eco-friendly materials and incorporating green building standards like leed or griha,"['sustainable architecture', 'leed', 'griha', 'energy modeling', 'green materials', 'building codes', 'autocad', 'revit']",,,,,,,,,,,,,,,,,
412,environmental compliance specialist,ensures that organizational operations and projects adhere to local and federal environmental regulations and sustainability standards,"['environmental law', 'regulatory compliance', 'auditing', 'risk assessment', 'permitting', 'environmental impact assessment', 'iso 14001']",,,,,,,,,,,,,,,,,
413,mern stack developer,builds and maintains full stack web applications using mongodb express.js react and node.js with a focus on high performance and scalability,"['mongodb', 'express.js', 'react', 'node.js', 'javascript', 'redux', 'rest api', 'jwt', 'mongoose', 'html5', 'css3', 'git']",,,,,,,,,,,,,,,,,
414,mean stack developer,develops enterprise level web applications utilizing the mean stack consisting of mongodb express.js angular and node.js for robust architecture,"['mongodb', 'express.js', 'angular', 'node.js', 'typescript', 'javascript', 'rxjs', 'rest api', 'no-sql', 'git', 'sass']",,,,,,,,,,,,,,,,,
415,full stack python developer,designs and implements end-to-end web applications using python frameworks for the backend and modern javascript libraries for the frontend,"['python', 'django', 'flask', 'react', 'mysql', 'postgresql', 'rest api', 'aws', 'docker', 'javascript', 'html', 'css']",,,,,,,,,,,,,,,,,
416,flutter developer,creates high performance cross-platform mobile applications for android and ios using the flutter framework and dart programming language,"['flutter', 'dart', 'firebase', 'state management', 'rest api', 'git', 'mobile ui/ux', 'sqlite', 'material design', 'widget testing']",,,,,,,,,,,,,,,,,
417,react native developer,develops native mobile applications for multiple platforms using react native while ensuring consistent performance and responsive design,"['react native', 'javascript', 'typescript', 'redux', 'mobile app development', 'rest api', 'native modules', 'ios development', 'android development']",,,,,,,,,,,,,,,,,
418,blockchain developer,designs and implements secure blockchain protocols and smart contracts for decentralized applications using technologies like ethereum or solidity,"['blockchain', 'smart contracts', 'solidity', 'ethereum', 'web3.js', 'cryptography', 'rust', 'hyperledger', 'ipfs', 'truffle', 'ganache']",,,,,,,,,,,,,,,,,
419,api developer,specializes in designing and building scalable and secure rest and graphql apis to facilitate seamless communication between software systems,"['rest api', 'graphql', 'node.js', 'python', 'postman', 'swagger', 'api security', 'microservices', 'oauth2', 'documentation']",,,,,,,,,,,,,,,,,
420,shopify/e-commerce developer,customizes and manages e-commerce platforms using shopify liquid and specialized apps to optimize the online shopping experience,"['shopify', 'liquid', 'e-commerce', 'javascript', 'html', 'css', 'api integration', 'storefront api', 'payment gateways', 'seo']",,,,,,,,,,,,,,,,,
421,full stack java developer,develops comprehensive web solutions using java spring boot for backend services and modern frontend frameworks like react or angular,"['java', 'spring boot', 'hibernate', 'react', 'angular', 'mysql', 'maven', 'docker', 'microservices', 'rest api', 'junit']",,,,,,,,,,,,,,,,,
422,game developer (unity/unreal),designs and codes interactive video games using game engines like unity or unreal engine while optimizing for performance and graphics,"['unity', 'unreal engine', 'c#', 'c++', 'game design', '3d modeling', 'physics engines', 'vr/ar', 'shader programming', 'animation']",,,,,,,,,,,,,,,,,
423,fintech product manager,manages the lifecycle of digital financial products like mobile banking and payment systems while bridging technical teams and business strategy,"['product strategy', 'market research', 'agile', 'fintech regulations', 'digital payments', 'blockchain basics', 'data analytics', 'jira', 'stakeholder management', 'roadmap planning']",,,,,,,,,,,,,,,,,
424,quantitative analyst,develops mathematical models and algorithms to analyze financial markets and manage risk while utilizing advanced statistical techniques and programming,"['python', 'c++', 'sql', 'r', 'statistics', 'financial modeling', 'risk management', 'machine learning', 'linear algebra', 'matlab', 'time-series analysis']",,,,,,,,,,,,,,,,,
425,blockchain solutions architect,designs and implements secure decentralized architectures for financial services while ensuring scalability and integration with legacy banking systems,"['blockchain', 'smart contracts', 'cryptography', 'ethereum', 'hyperledger', 'api design', 'microservices architecture', 'distributed systems', 'regulatory compliance']",,,,,,,,,,,,,,,,,
426,digital transformation consultant,assists financial organizations in adopting digital technologies to modernize operations and enhance customer experiences through automation and ai,"['digital strategy', 'change management', 'cloud migration', 'data analytics', 'automation', 'business process optimization', 'it consulting', 'stakeholder engagement']",,,,,,,,,,,,,,,,,
427,customer success architect,serves as a technical advisor to fintech clients to ensure product adoption and maturity while maintaining strong consultative relationships,"['customer success', 'technical enablement', 'post-sales support', 'crm', 'saas', 'project management', 'communication', 'business alignment', 'retention strategy']",,,,,,,,,,,,,,,,,
428,salesforce architect,designs and implements scalable high-performance salesforce solutions for enterprise financial institutions while managing complex system integrations,"['salesforce platform', 'apex', 'visualforce', 'lightning', 'mulesoft', 'api integration', 'data modeling', 'security governance', 'solution design']",,,,,,,,,,,,,,,,,
429,sap s/4hana consultant,manages the digital transformation of financial processes using sap technology focusing on accounting principles and industry best practices,"['sap s/4hana finance', 'sap central finance', 'sap fico', 'sap analytics cloud', 'sap activate', 'business process mapping', 'configuration', 'blueprint design']",,,,,,,,,,,,,,,,,
430,fintech compliance officer,ensures that digital financial tools and platforms meet strict regulatory requirements such as anti-money laundering aml and kyc standards,"['aml', 'kyc', 'financial regulations', 'risk assessment', 'compliance auditing', 'data privacy', 'reporting', 'regulatory liaison']",,,,,,,,,,,,,,,,,
431,treasury technologist,optimizes corporate treasury functions through the implementation of automated treasury management systems and financial data integration,"['treasury management systems', 'cash flow forecasting', 'financial risk management', 'api integration', 'sap', 'data visualization', 'swift']",,,,,,,,,,,,,,,,,
432,blockchain risk analyst,evaluates the security and financial risks associated with blockchain-based protocols and cryptocurrency transactions for institutional investors,"['cryptocurrency risk analysis', 'smart contract auditing', 'blockchain forensics', 'financial risk modeling', 'compliance', 'security protocols']",,,,,,,,,,,,,,,,,
433,scrum master,facilitates the agile process for development teams by removing blockers and ensuring adherence to scrum values and practices,"['scrum', 'kanban', 'jira', 'agile coaching', 'facilitation', 'confluence', 'servant leadership', 'sprint planning', 'backlog grooming']",,,,,,,,,,,,,,,,,
434,agile coach,trains and mentors organizations on agile methodologies to improve team performance and foster a culture of continuous improvement,"['agile transformation', 'lean', 'safe', 'mentoring', 'strategic planning', 'change management', 'organizational development', 'communication']",,,,,,,,,,,,,,,,,
435,delivery manager,oversees the successful delivery of complex software projects while managing timelines budgets and stakeholder expectations,"['project management', 'agile', 'risk management', 'budgeting', 'stakeholder management', 'delivery metrics', 'jira', 'confluence', 'resource planning']",,,,,,,,,,,,,,,,,
436,release train engineer (rte),leads the agile release train in a safe environment by facilitating events and managing risks for large scale program delivery,"['safe', 'program management', 'facilitation', 'lean-agile leadership', 'risk management', 'pi planning', 'stakeholder engagement']",,,,,,,,,,,,,,,,,
437,solution architect,designs comprehensive technical solutions for specific business problems while ensuring technical feasibility and alignment with enterprise standards,"['system design', 'cloud architecture', 'api design', 'microservices', 'technical leadership', 'security', 'scalability', 'integration strategy']",,,,,,,,,,,,,,,,,
438,enterprise architect,defines the long-term technical vision and standards for an entire organization to ensure IT infrastructure supports business strategy,"['it strategy', 'enterprise architecture frameworks', 'togaf', 'cloud strategy', 'governance', 'digital transformation', 'stakeholder alignment']",,,,,,,,,,,,,,,,,
439,technical program manager,manages large scale technical programs involving multiple cross functional teams while driving technical requirements and delivery,"['program management', 'technical depth', 'agile', 'sdlc', 'stakeholder management', 'risk mitigation', 'dependency management', 'product lifecycle']",,,,,,,,,,,,,,,,,
440,it project manager,plans and executes it projects while managing resources budgets and schedules to ensure delivery on time and within scope,"['ms project', 'pmp', 'itil', 'budget management', 'risk assessment', 'communication', 'technical coordination', 'sdlc']",,,,,,,,,,,,,,,,,
441,product owner,defines product vision and manages the product backlog to maximize the value delivered by the development team in an agile environment,"['backlog management', 'user stories', 'agile', 'jira', 'product strategy', 'stakeholder engagement', 'market analysis', 'prioritization']",,,,,,,,,,,,,,,,,
442,automation business analyst,analyzes business processes to identify automation opportunities while creating process definition documents and calculating roi,"['process mapping', 'rpa basics', 'pdd', 'roi calculation', 'business analysis', 'stakeholder management', 'uipath basics', 'documentation']",,,,,,,,,,,,,,,,,
443,bioinformatics scientist,applies computational tools to manage and interpret biological and clinical data to support the development of new treatments and precision medicine,"['python', 'r', 'sql', 'ngs', 'genomics', 'machine learning', 'data visualization', 'biostatistics', 'linux', 'perl', 'database management', 'cloud computing']",,,,,,,,,,,,,,,,,
444,health informatics specialist,gathers and analyzes key healthcare data in various settings to optimize workflows and improve patient care through information systems,"['ehr', 'emr', 'data analytics', 'sql', 'python', 'hl7', 'fhir', 'hipaa', 'project management', 'database design', 'change management', 'clinical decision support']",,,,,,,,,,,,,,,,,
445,medical device integration engineer,leads the plan development and implementation of medical device connectivity with clinical information systems while ensuring regulatory compliance,"['dicom', 'hl7', 'imaging informatics', 'python', 'sql', 'pacs', 'ris/emr', 'risk analysis', 'cybersecurity', 'medical device regulations', 'interoperability']",,,,,,,,,,,,,,,,,
446,digital health product lead,leads the strategy and optimization of digital health products by collaborating with cross-functional teams to deliver user-centric healthcare solutions,"['product strategy', 'healthcare workflows', 'agile', 'digital marketing', 'market intelligence', 'ux/ui design', 'stakeholder communication', 'regulatory compliance']",,,,,,,,,,,,,,,,,
447,biostatistician,designs and analyzes medical research studies using mathematical and scientific principles to draw accurate conclusions about medicine and risk factors,"['sas', 'r', 'statistics', 'stata', 'clinical trials', 'data cleaning', 'longitudinal analysis', 'epidemiology', 'experimental design', 'statistical modeling']",,,,,,,,,,,,,,,,,
448,clinical research associate,oversees the conduct and monitoring of clinical trials to ensure data integrity patient safety and compliance with study protocols,"['clinical trials', 'gcp', 'monitoring', 'regulatory compliance', 'data integrity', 'patient safety', 'project coordination', 'medical writing']",,,,,,,,,,,,,,,,,
449,biomedical engineer,designs and maintains biomedical devices and equipment such as artificial organs while combining engineering concepts with medical knowledge,"['biomedical engineering', 'medical devices', 'autocad', 'robotics', 'software engineering', 'regulatory compliance', 'calibration', 'electronics', 'maintenance']",,,,,,,,,,,,,,,,,
450,genomics data scientist,focuses on analyzing large-scale genomic datasets to identify biomarkers and therapeutic targets for personalized healthcare initiatives,"['genomics', 'data science', 'python', 'ngs', 'variant calling', 'machine learning', 'statistics', 'r', 'bioinformatics pipelines', 'cloud computing']",,,,,,,,,,,,,,,,,
451,health data researcher,utilizes diverse health data sources to identify trends in public health and evaluate the effectiveness of healthcare interventions,"['data analysis', 'public health', 'epidemiology', 'statistics', 'r', 'python', 'literature review', 'policy analysis', 'health economics']",,,,,,,,,,,,,,,,,
452,medical device software engineer,designs and develops software solutions that power medical devices while ensuring they meet technical and safety standards,"['c', 'c++', 'python', 'embedded systems', 'regulatory standards', 'iec 62304', 'fda guidelines', 'agile', 'software architecture', 'verification']",,,,,,,,,,,,,,,,,
453,frontend developer,designs and develops user facing features for web applications using html css and javascript collaborates with ux ui designers to implement responsive designs,"['css', 'sass', 'vue.js', 'node.js', 'typescript', 'ux design', 'javascript', 'react', 'html', 'angular']",,,,,,,,,,,,,,,,,


454,data governance analyst,manages the framework for data assets ensuring compliance with policies and standards while maintaining data quality and security,"['data governance', 'compliance', 'data quality', 'sql', 'risk management', 'policy development', 'data cataloging', 'stakeholder management']",,,,,,,,,,,,,,,,,
455,data privacy engineer,designs and implements technical solutions to protect user privacy and ensure compliance with data protection regulations,"['gdpr', 'data encryption', 'privacy by design', 'risk assessment', 'security', 'ccpa', 'data masking', 'anonymization']",,,,,,,,,,,,,,,,,
456,data stewardship manager,oversees the lifecycle of data assets and coordinates with data owners to ensure data accuracy and reliability,"['data quality', 'data management', 'leadership', 'metatdata management', 'communication', 'business analysis', 'governance']",,,,,,,,,,,,,,,,,
457,data platform engineer,builds and maintains the underlying infrastructure and services that power data processing and storage,"['distributed systems', 'kubernetes', 'cloud infrastructure', 'data pipelines', 'scala', 'python', 'terraform', 'spark']",,,,,,,,,,,,,,,,,
458,analytics engineer,bridges the gap between data engineering and data analysis by transforming raw data into clean well-structured datasets,"['dbt', 'sql', 'data modeling', 'snowflake', 'python', 'version control', 'bigquery', 'data warehousing']",,,,,,,,,,,,,,,,,
459,decision scientist,applies advanced analytics and behavioral science to help organizations make data-driven strategic decisions,"['statistical modeling', 'r', 'python', 'behavioral economics', 'data visualization', 'decision theory', 'sql', 'machine learning']",,,,,,,,,,,,,,,,,
460,experimentation engineer,designs and builds platforms for a/b testing and statistical experiments to drive product optimization,"['statistical analysis', 'a/b testing', 'experimental design', 'python', 'data analysis', 'software engineering', 'metrics definition']",,,,,,,,,,,,,,,,,
461,growth engineer,focuses on technical initiatives to improve user acquisition retention and revenue through rapid experimentation,"['full stack development', 'data analysis', 'a/b testing', 'marketing automation', 'api integration', 'python', 'javascript', 'sql']",,,,,,,,,,,,,,,,,
462,growth data analyst,analyzes user behavior data to identify opportunities for growth and provides insights for marketing and product teams,"['sql', 'python', 'funnel analysis', 'data visualization', 'statistics', 'tableau', 'google analytics', 'behavioral analytics']",,,,,,,,,,,,,,,,,
463,customer data platform engineer,implements and manages platforms that unify customer data from multiple sources to create a single view,"['cdp', 'api integration', 'data identity resolution', 'sql', 'cloud computing', 'segment', 'data mapping', 'etl']",,,,,,,,,,,,,,,,,
464,recommendation systems engineer,develops and optimizes algorithms that suggest products or content to users based on preferences and behavior,"['machine learning', 'collaborative filtering', 'python', 'deep learning', 'search algorithms', 'spark', 'nlp', 'pytorch']",,,,,,,,,,,,,,,,,
465,search relevance engineer,improves the quality of search results by tuning ranking algorithms and leveraging natural language processing,"['elasticsearch', 'solr', 'lucene', 'nlp', 'ranking algorithms', 'information retrieval', 'machine learning', 'python']",,,,,,,,,,,,,,,,,
466,knowledge graph engineer,designs and builds graph-based data structures to represent complex relationships and improve data discoverability,"['graph databases', 'neo4j', 'sparql', 'rdf', 'ontology', 'semantic web', 'python', 'data modeling']",,,,,,,,,,,,,,,,,
467,ontology engineer,develops formal representations of categories and relationships within specific domains to enable better data integration,"['owl', 'protege', 'semantic modeling', 'taxonomy', 'knowledge representation', 'logic', 'rdf', 'data architecture']",,,,,,,,,,,,,,,,,
468,semantic data engineer,focuses on creating meaningful data structures and schemas that enable machines to understand and link information,"['semantic web', 'linked data', 'rdf', 'json-ld', 'data modeling', 'api design', 'metadata management', 'sql']",,,,,,,,,,,,,,,,,
469,database reliability engineer,ensures the performance availability and scalability of database systems through automation and monitoring,"['database administration', 'sre', 'automation', 'sql', 'nosql', 'monitoring', 'backup recovery', 'python', 'linux']",,,,,,,,,,,,,,,,,
470,distributed systems engineer,designs and builds large-scale software systems that run across multiple networked computers,"['distributed computing', 'go', 'c++', 'networking', 'concurrency', 'cloud infrastructure', 'system design', 'microservices']",,,,,,,,,,,,,,,,,
471,performance engineer,identifies and resolves performance bottlenecks in software applications and infrastructure,"['load testing', 'benchmarking', 'profiling', 'jmeter', 'performance monitoring', 'java', 'python', 'optimization']",,,,,,,,,,,,,,,,,
472,capacity planning engineer,forecasts future resource requirements for infrastructure and ensures systems can handle growth,"['statistical forecasting', 'cloud cost management', 'infrastructure', 'monitoring', 'data analysis', 'capacity modeling', 'devops']",,,,,,,,,,,,,,,,,
473,storage engineer,manages and optimizes large-scale data storage systems including cloud storage and physical arrays,"['san', 'nas', 'cloud storage', 'backup solutions', 'networking', 'linux', 'hardware management', 'object storage']",,,,,,,,,,,,,,,,,
474,compute infrastructure engineer,focuses on providing and managing the processing power needed for applications through virtualization and cloud,"['virtualization', 'aws', 'bare metal', 'kubernetes', 'linux', 'server management', 'infrastructure as code', 'docker']",,,,,,,,,,,,,,,,,
475,edge ai engineer,deploys and optimizes machine learning models to run on edge devices with limited processing power,"['embedded systems', 'model compression', 'tensorflow lite', 'c++', 'python', 'iot', 'computer vision', 'onnx']",,,,,,,,,,,,,,,,,
476,hpc engineer (high performance computing),manages and optimizes supercomputing clusters for complex scientific and engineering simulations,"['linux', 'parallel computing', 'mpi', 'gpu computing', 'slurm', 'c++', 'fortran', 'cluster management']",,,,,,,,,,,,,,,,,
477,quantum software engineer,develops software tools and applications that run on quantum hardware or simulators,"['quantum mechanics', 'qiskit', 'cirq', 'python', 'quantum algorithms', 'linear algebra', 'software engineering']",,,,,,,,,,,,,,,,,
478,quantum algorithm researcher,designs and analyzes new algorithms specifically for quantum computers to solve complex problems,"['quantum computing', 'algorithm design', 'mathematics', 'physics', 'computational complexity', 'research', 'scientific computing']",,,,,,,,,,,,,,,,,
479,quantum machine learning engineer,integrates quantum computing techniques with machine learning models to accelerate training or improve accuracy,"['quantum algorithms', 'machine learning', 'python', 'tensorflow quantum', 'pennylane', 'deep learning', 'statistics']",,,,,,,,,,,,,,,,,
480,spatial computing developer,creates applications that interact with the physical world using augmented and virtual reality technologies,"['unity', 'unreal engine', 'c#', 'c++', 'computer vision', '3d modeling', 'arcore', 'arkit']",,,,,,,,,,,,,,,,,
481,xr developer (extended reality),develops immersive experiences spanning augmented virtual and mixed reality,"['xr design', 'unity', 'unreal engine', '3d math', 'ui/ux for xr', 'spatial audio', 'c#', 'interactive design']",,,,,,,,,,,,,,,,,
482,ar developer (augmented reality),specializes in overlaying digital information onto the real world via mobile devices or ar glasses,"['arkit', 'arcore', 'vuforia', 'unity', 'c#', 'computer vision', 'mobile development', 'lens studio']",,,,,,,,,,,,,,,,,
483,vr developer (virtual reality),builds fully immersive digital environments for gaming training or simulation,"['unity', 'unreal engine', 'vr hardware api', 'c#', '3d environment design', 'optimization', 'spatial audio']",,,,,,,,,,,,,,,,,
