job_id,job_title,job_description_clean,skills,salary_usd,salary_currency,experience_level,employment_type,company_location,company_size,employee_residence,remote_ratio,required_skills,education_required,years_experience,industry,posting_date,application_deadline,job_description_length,benefits_score,company_name
82,docker engineer,manages containerization solutions using docker while ensuring efficient deployment of applications across environments,"['docker', 'containerization', 'automation', 'kubernetes', 'networking', 'cloud computing', 'linux']",,,,,,,,,,,,,,,,,
83,embedded software engineer,develops software for embedded systems by writing low level code that interfaces directly with hardware components,"['embedded c', 'firmware development', 'microcontrollers', 'rtos', 'communication protocols', 'hardware design', 'testing']",,,,,,,,,,,,,,,,,
84,entry level developer,assists in developing software applications under supervision while gaining experience in coding debugging practices,"['css', 'javascript', 'python', 'data structures', 'java', 'html', 'git', 'database', 'algorithms']",,,,,,,,,,,,,,,,,
85,entry level network engineer,supports network infrastructure by assisting with configuration troubleshooting tasks while gaining hands on experience,"['routing', 'troubleshooting', 'tcp', 'switching', 'networking', 'windows server', 'linux']",,,,,,,,,,,,,,,,,
86,entry level programmer,writes basic code under supervision while learning programming concepts techniques through practical application,"['python', 'c++', 'data structures', 'java', 'debugging', 'programming', 'algorithms']",,,,,,,,,,,,,,,,,
87,entry level software developer,assists in developing software applications while gaining experience in coding debugging practices under supervision,"['css', 'javascript', 'python', 'data structures', 'java', 'html', 'git', 'database', 'algorithms']",,,,,,,,,,,,,,,,,
88,entry level software engineer,participates in software development projects while gaining practical experience in coding debugging under guidance,"['css', 'javascript', 'python', 'data structures', 'java', 'html', 'git', 'database', 'algorithms']",,,,,,,,,,,,,,,,,
89,entry level web developer,assists in developing web applications while learning front end back end technologies through practical experience,"['css', 'web development fundamentals', 'javascript', 'ux basics', 'html', 'git']",,,,,,,,,,,,,,,,,
90,envoy engineer,implements envoy proxy solutions within microservices architectures while focusing on traffic management security policies,"['docker', 'envoy', 'kubernetes', 'service mesh', 'security', 'networking', 'cloud computing', 'traffic management']",,,,,,,,,,,,,,,,,
91,falco engineer,utilizes falco for runtime security monitoring of containerized applications while implementing threat detection mechanisms,"['docker', 'threat detection', 'falco', 'kubernetes', 'security', 'cloud computing', 'system monitoring']",,,,,,,,,,,,,,,,,
92,fluentd engineer,configures fluentd as a log collector aggregator while managing log ingestion pipelines into storage analytics platforms,"['elasticsearch', 'data collection', 'kibana', 'fluentd', 'log management', 'data processing', 'cloud computing']",,,,,,,,,,,,,,,,,
93,fortify engineer,conducts static dynamic application security testing using fortify tools while identifying remediating vulnerabilities within applications,"['.net', 'fortify', 'security', 'vulnerability management', 'static code analysis', 'java', 'software development']",,,,,,,,,,,,,,,,,
94,frameworks specialist,specializes in specific frameworks e g react angular by developing applications based on best practices within those frameworks,"['vue.js', 'django', 'javascript', 'react', 'framework development', 'python', 'java', 'spring framework', 'angular']",,,,,,,,,,,,,,,,,
95,front end developer,designs and develops user facing features for web applications using html css and javascript collaborates with ux ui designers to implement responsive designs,"['css', 'sass', 'vue.js', 'node.js', 'typescript', 'ux design', 'javascript', 'react', 'html', 'angular']",,,,,,,,,,,,,,,,,
96,front end web developer,creates and maintains the visual components of web applications responsible for optimizing applications for maximum speed and scalability,"['css', 'sass', 'vue.js', 'node.js', 'typescript', 'ux design', 'javascript', 'react', 'html', 'angular']",,,,,,,,,,,,,,,,,
97,full stack developer,develops both front end and back end components of web applications requires proficiency in multiple programming languages and frameworks,"['css', 'devops', 'node.js', 'django', 'javascript', 'react', 'python', 'html', 'express.js', 'mongodb', 'database', 'angular']",,,,,,,,,,,,,,,,,
98,full stack java developer/programmer/engineer,designs and develops full stack applications using java technologies responsible for both server side logic and user interface design,"['css', 'microservices', 'junit', 'maven', 'javascript', 'hibernate', 'jenkins', 'react', 'java', 'html', 'spring framework', 'rest apis', 'git', 'cloud computing', 'database', 'j2ee']",,,,,,,,,,,,,,,,,
99,full stack python developer/programmer/engineer,creates full stack applications using python frameworks e g django responsible for developing both client side and server side components,"['css', 'docker', 'django', 'javascript', 'python', 'react', 'data structures', 'html', 'rest apis', 'cloud computing', 'git', 'database', 'flask', 'linux', 'algorithms']",,,,,,,,,,,,,,,,,
100,game developer,designs and develops video games across platforms responsible for coding gameplay mechanics graphics and user interactions,"['javascript', 'unity', 'game engines', 'c++', 'vr development', 'unreal engine', 'game design']",,,,,,,,,,,,,,,,,
101,gcp devops engineer,implements devops practices on google cloud platform responsible for automating deployments managing ci cd pipelines and ensuring system reliability,"['ansible', 'devops', 'docker', 'google cloud', 'automation', 'kubernetes', 'linux', 'terraform', 'scripting']",,,,,,,,,,,,,,,,,
102,gerrit engineer,manages gerrit code review system to facilitate collaborative development responsibilities include configuring projects and managing user access,"['version control', 'automation', 'code review', 'git', 'gerrit', 'linux', 'scripting']",,,,,,,,,,,,,,,,,
103,git engineer,specializes in git version control systems responsible for managing repositories branching strategies and ensuring code integrity during development,"['version control', 'automation', 'code review', 'git', 'branching strategies', 'scripting']",,,,,,,,,,,,,,,,,
104,github engineer,manages github repositories for version control responsibilities include setting up workflows managing pull requests and collaborating with teams,"['version control', 'automation', 'github', 'github actions', 'git', 'scripting']",,,,,,,,,,,,,,,,,
105,gitlab engineer,administers gitlab repositories for version control responsible for configuring ci cd pipelines and managing project settings,"['version control', 'automation', 'gitlab', 'gitlab ci', 'git', 'scripting']",,,,,,,,,,,,,,,,,
106,gradle engineer,utilizes gradle build automation tools to manage project dependencies and build processes responsible for optimizing build configurations,"['version control', 'build automation', 'groovy', 'java', 'git', 'gradle']",,,,,,,,,,,,,,,,,
107,grafana engineer,implements grafana dashboards for data visualization responsible for monitoring metrics from various sources to provide insights into system performance,"['dashboards', 'monitoring', 'metrics', 'linux', 'cloud computing', 'data visualization', 'alerting', 'grafana']",,,,,,,,,,,,,,,,,
108,groovy engineer,develops scripts using groovy programming language to automate tasks within java applications or build processes,"['build automation', 'automation', 'jenkins', 'groovy', 'java', 'scripting']",,,,,,,,,,,,,,,,,
109,information architect,designs information systems that provide clear navigation structures for users works on organizing content effectively across digital platforms,"['user research', 'content strategy', 'prototyping', 'information architecture', 'ux design', 'wireframing']",,,,,,,,,,,,,,,,,
110,information security analyst,protects an organization s computer systems by implementing security measures responsibilities include monitoring networks for security breaches,"['security auditing', 'security', 'vulnerability management', 'firewalls', 'ips', 'ids', 'network security', 'penetration testing']",,,,,,,,,,,,,,,,,
111,interaction designer,focuses on creating engaging interfaces that enhance user experience responsibilities include conducting user research and usability testing,"['user research', 'usability testing', 'interaction design', 'prototyping', 'ux design', 'wireframing']",,,,,,,,,,,,,,,,,
112,ios developer,develops mobile applications for ios devices using swift or objective c responsible for implementing ui designs and ensuring app performance,"['ios sdk', 'mobile development', 'swift', 'rest apis', 'database', 'objective-c', 'xcode', 'ux design']",,,,,,,,,,,,,,,,,
113,istio engineer,implements service mesh solutions using istio to manage microservices communication focuses on traffic management security policies and observability,"['istio', 'docker', 'kubernetes', 'service mesh', 'security', 'networking', 'cloud computing', 'traffic management']",,,,,,,,,,,,,,,,,
114,it manager,oversees it operations within an organization responsibilities include managing it staff budgeting and ensuring alignment with business goals,"['budgeting', 'cybersecurity', 'team leadership', 'agile methodologies', 'networking', 'project management', 'it infrastructure', 'cloud computing']",,,,,,,,,,,,,,,,,
115,jacoco engineer,utilizes jacoco to measure code coverage in java applications responsible for integrating coverage reporting into ci cd pipelines,"['jacoco', 'code coverage', 'java', 'quality assurance', 'testing']",,,,,,,,,,,,,,,,,
116,java developer,develops software applications using java programming language responsibilities include writing code debugging and collaborating with team members on projects,"['microservices', 'junit', 'maven', 'hibernate', 'jenkins', 'java', 'spring framework', 'rest apis', 'git', 'cloud computing', 'database', 'j2ee']",,,,,,,,,,,,,,,,,
117,javascript developer,creates interactive web applications using javascript frameworks libraries like react or angular focuses on front end development best practices,"['css', 'sass', 'vue.js', 'node.js', 'typescript', 'ux design', 'javascript', 'react', 'html', 'angular']",,,,,,,,,,,,,,,,,
118,jira engineer,administers jira project management tool to support agile teams responsibilities include configuring workflows managing projects and providing user support,"['agile methodologies', 'jira', 'project management', 'workflow configuration', 'user management', 'atlassian suite']",,,,,,,,,,,,,,,,,
119,jr developer,assists in software development tasks under supervision while gaining practical experience in coding debugging practices,"['css', 'javascript', 'python', 'data structures', 'java', 'html', 'git', 'database', 'algorithms']",,,,,,,,,,,,,,,,,
120,junior developer,supports development teams by writing code under guidance while learning best practices in software development,"['css', 'javascript', 'python', 'data structures', 'java', 'html', 'git', 'database', 'algorithms']",,,,,,,,,,,,,,,,,
121,junior front end developer,assists in developing front end components of web applications while learning html css javascript,"['css', 'vue.js', 'javascript', 'ux basics', 'react', 'html', 'git']",,,,,,,,,,,,,,,,,
122,junior ios developer,supports ios application development efforts while gaining hands on experience with swift objective c,"['ios sdk', 'swift', 'ux basics', 'git', 'objective-c', 'xcode']",,,,,,,,,,,,,,,,,
123,junior software developer,participates in software development projects while gaining practical experience through coding debugging tasks,"['css', 'javascript', 'python', 'data structures', 'java', 'html', 'git', 'database', 'algorithms']",,,,,,,,,,,,,,,,,
124,junior software engineer,assists in engineering tasks related to software development while learning from experienced team members,"['css', 'javascript', 'python', 'data structures', 'java', 'html', 'git', 'database', 'algorithms']",,,,,,,,,,,,,,,,,
125,junior web developer,supports web development efforts by writing basic code under supervision while learning front end back end technologies,"['css', 'web development fundamentals', 'javascript', 'ux basics', 'html', 'git']",,,,,,,,,,,,,,,,,
126,junit engineer,utilizes junit framework to write unit tests for java applications responsibilities include ensuring code quality through automated testing,"['junit', 'test automation', 'java', 'unit testing', 'testing']",,,,,,,,,,,,,,,,,
127,kubernetes administrator,manages and maintains kubernetes clusters ensuring high availability scalability and security of containerized applications works closely with devops development and it teams to deploy troubleshoot and optimize kubernetes based infrastructure,"['aws', 'docker', 'automation', 'kubernetes', 'security', 'networking', 'cloud computing', 'linux', 'azure']",,,,,,,,,,,,,,,,,
128,kubernetes engineer,designs and implements kubernetes solutions for container orchestration while ensuring high availability of services,"['aws', 'docker', 'automation', 'kubernetes', 'security', 'networking', 'cloud computing', 'linux', 'azure']",,,,,,,,,,,,,,,,,
129,maven engineer,manages build processes using maven for java applications responsibilities include configuring pom xml files and optimizing build performance,"['version control', 'build automation', 'maven', 'java', 'dependency management', 'git']",,,,,,,,,,,,,,,,,
130,micro services / api lead designer,responsible for architecting designing and leading the development of scalable secure and efficient microservices based applications collaborate closely with engineering devops and product teams to define api strategies ensure seamless integration and optimize system performance,"['microservices', 'python', 'soa', 'api design', 'java', 'security', 'rest apis', 'cloud computing']",,,,,,,,,,,,,,,,,
131,mobile app developer,develops mobile applications for platforms like android and ios responsibilities include designing user interfaces and integrating backend services,"['ios', 'mobile development', 'swift', 'android sdk', 'react', 'kotlin', 'java', 'objective-c', 'flutter', 'ux design']",,,,,,,,,,,,,,,,,
132,mobile application developer,creates mobile applications using frameworks like react native or flutter focuses on delivering high quality user experiences across devices,"['ios', 'mobile development', 'swift', 'android sdk', 'react', 'kotlin', 'java', 'objective-c', 'flutter', 'ux design']",,,,,,,,,,,,,,,,,
133,mulesoft developer,designs and develops integration solutions using mulesoft anypoint platform responsible for creating apis and managing data flows between systems,"['integration', 'soa', 'java', 'rest apis', 'api development', 'mulesoft', 'anypoint platform']",,,,,,,,,,,,,,,,,
134,nagios engineer,implements nagios monitoring solutions to track system performance and availability responsible for configuring alerts and managing monitoring plugins,"['nagios', 'system administration', 'monitoring', 'networking', 'linux', 'alerting', 'scripting']",,,,,,,,,,,,,,,,,
135,network and systems administrator,manages network infrastructure and systems to ensure operational efficiency responsibilities include troubleshooting maintenance and user support,"['troubleshooting', 'system administration', 'automation', 'networking', 'windows server', 'linux', 'scripting']",,,,,,,,,,,,,,,,,
136,network engineer,designs implements and manages network solutions to ensure reliable connectivity responsibilities include configuring routers switches and monitoring network performance,"['routing', 'tcp', 'lan', 'networking protocols', 'switching', 'vpn', 'security', 'firewalls', 'wan', 'cisco']",,,,,,,,,,,,,,,,,
137,new grad software engineer,entry level position focused on software development tasks while gaining practical experience in coding debugging under supervision,"['css', 'javascript', 'python', 'data structures', 'java', 'html', 'git', 'database', 'algorithms']",,,,,,,,,,,,,,,,,
138,new relic engineer,utilizes new relic for application performance monitoring responsibilities include configuring dashboards analyzing metrics and optimizing application performance,"['.net', 'new relic', 'troubleshooting', 'metrics', 'java', 'cloud computing', 'application performance monitoring', 'alerting']",,,,,,,,,,,,,,,,,
139,nexus engineer,manages nexus repository for artifact management in ci cd pipelines responsible for configuring repositories and ensuring efficient artifact storage,"['build automation', 'docker', 'maven', 'nexus', 'artifact repository', 'gradle']",,,,,,,,,,,,,,,,,
140,nomad engineer,implements nomad for workload orchestration across distributed systems responsibilities include managing job definitions and ensuring service availability,"['docker', 'automation', 'networking', 'container orchestration', 'cloud computing', 'linux', 'nomad']",,,,,,,,,,,,,,,,,
141,notary engineer,utilizes notary for secure signing of container images responsible for implementing trust management within containerized environments,"['container security', 'docker', 'security', 'trust management', 'notary', 'cryptography']",,,,,,,,,,,,,,,,,
142,octopus deploy engineer,manages deployment processes using octopus deploy responsibilities include configuring deployment projects and automating release workflows,"['.net', 'deployment automation', 'octopus deploy', 'cloud computing', 'powershell', 'scripting']",,,,,,,,,,,,,,,,,
143,openshift engineer,administers openshift container platform for deploying applications responsibilities include managing clusters scaling applications and ensuring uptime,"['docker', 'automation', 'kubernetes', 'security', 'cloud computing', 'linux', 'openshift']",,,,,,,,,,,,,,,,,
144,openstack engineer,implements openstack solutions for cloud infrastructure management responsible for deploying services and managing virtualized resources,"['openstack', 'automation', 'networking', 'cloud computing', 'virtualization', 'linux', 'scripting']",,,,,,,,,,,,,,,,,
145,oracle developer,develops applications using oracle technologies including pl sql responsibilities include database design coding testing and optimization,"['etl', 'performance tuning', 'database', 'oracle']",,,,,,,,,,,,,,,,,
146,oracle sql developer,utilizes oracle sql developer to manage database development tasks including writing queries creating reports and optimizing database performance,"['etl', 'performance tuning', 'database']",,,,,,,,,,,,,,,,,
147,packer engineer,uses packer to automate the creation of machine images across platforms responsible for maintaining image templates and ensuring consistency in deployments,"['aws', 'google cloud', 'automation', 'packer', 'infrastructure as code', 'cloud computing', 'azure']",,,,,,,,,,,,,,,,,
148,php developer,develops web applications using php programming language responsibilities include coding debugging and collaborating with front end developers on integrations,"['css', 'javascript', 'restful apis', 'symfony', 'php', 'html', 'git', 'database', 'laravel']",,,,,,,,,,,,,,,,,
149,powershell engineer,utilizes powershell scripting to automate administrative tasks in windows environments responsible for writing scripts to manage system configurations,"['automation', 'active directory', 'windows server', 'cloud computing', 'powershell', 'scripting']",,,,,,,,,,,,,,,,,
150,product manager,oversees product development from conception to launch responsibilities include defining product vision gathering requirements and coordinating cross functional teams,"['user research', 'agile methodologies', 'stakeholder management', 'roadmap planning', 'product management', 'communication']",,,,,,,,,,,,,,,,,
151,programmer,writes code to develop software applications based on specifications provided by stakeholders collaborates with other developers on coding best practices,"['python', 'c++', 'data structures', 'java', 'debugging', 'programming', 'algorithms', 'software development']",,,,,,,,,,,,,,,,,
152,programmer analyst,analyzes business requirements to develop software solutions responsibilities include coding testing debugging and providing technical support,"['process improvement', 'data analysis', 'database', 'data modeling', 'programming', 'requirements gathering']",,,,,,,,,,,,,,,,,
153,prometheus engineer,implements prometheus monitoring solutions to track application performance metrics responsible for configuring alerts dashboards based on metrics collected,"['docker', 'monitoring', 'kubernetes', 'metrics', 'prometheus', 'cloud computing', 'alerting']",,,,,,,,,,,,,,,,,
154,puppet engineer,utilizes puppet for configuration management tasks across environments responsibilities include writing manifests scripts to automate system configurations,"['aws', 'automation', 'puppet', 'infrastructure as code', 'cloud computing', 'linux', 'azure', 'ruby', 'configuration management']",,,,,,,,,,,,,,,,,
155,pytest engineer,uses pytest framework to write unit tests for python applications responsible for ensuring code quality through automated testing practices,"['test automation', 'pytest', 'python', 'unit testing', 'testing']",,,,,,,,,,,,,,,,,
156,python developer,develops software applications using python programming language responsibilities include writing code debugging issues and collaborating with other developers,"['docker', 'django', 'python', 'data structures', 'rest apis', 'cloud computing', 'git', 'database', 'flask', 'linux', 'algorithms']",,,,,,,,,,,,,,,,,
157,qa engineer,implements testing strategies to ensure software quality through manual automated testing methods while collaborating with development teams on quality standards,"['agile testing', 'testng', 'junit', 'test automation', 'selenium', 'python', 'jenkins', 'performance testing', 'git', 'automation testing']",,,,,,,,,,,,,,,,,
158,react developer,develops user interfaces using react js framework responsibilities include implementing responsive designs and optimizing application performance,"['css', 'node.js', 'javascript', 'react', 'redux', 'html', 'git', 'ux design']",,,,,,,,,,,,,,,,,
159,robotics engineer,designs robotic systems by developing software hardware components that enable robots to perform tasks autonomously or semi autonomously,"['actuators', 'python', 'c++', 'robotics', 'ros', 'embedded systems', 'control systems', 'sensors']",,,,,,,,,,,,,,,,,
160,ruby on rails developer,develops web applications using ruby on rails framework while focusing on back end logic integrating front end components,"['css', 'javascript', 'ruby on rails', 'html', 'rest apis', 'git', 'database', 'ruby']",,,,,,,,,,,,,,,,,
161,salesforce developer,customizes salesforce platform by developing applications components using apex visualforce while ensuring alignment with business processes,"['soql', 'salesforce', 'lightning', 'visualforce', 'rest apis', 'salesforce administration', 'apex']",,,,,,,,,,,,,,,,,
162,search engine optimization,no description available,"['keyword research', 'analytics', 'content marketing', 'off-page optimization', 'seo', 'on-page optimization']",,,,,,,,,,,,,,,,,
163,security specialist,protects organizational data by implementing security measures responsibilities include conducting risk assessments and responding to security incidents,"['security auditing', 'security', 'vulnerability management', 'firewalls', 'ips', 'ids', 'network security', 'penetration testing']",,,,,,,,,,,,,,,,,
164,selenium engineer,designs and develops automated test scripts using selenium responsibilities include creating test plans executing tests and reporting defects,"['webdriver', 'testing frameworks', 'test automation', 'selenium', 'python', 'java']",,,,,,,,,,,,,,,,,
165,senior ansible development engineer,leads development efforts for ansible based automation solutions responsibilities include mentoring junior engineers and designing complex playbooks,"['ansible', 'aws', 'automation', 'python', 'networking', 'infrastructure as code', 'cloud computing', 'leadership', 'linux', 'azure', 'scripting']",,,,,,,,,,,,,,,,,
166,senior cloud architect,designs and implements cloud solutions at a senior level responsibilities include cloud strategy development and providing guidance on cloud best practices,"['aws', 'microservices', 'google cloud', 'docker', 'kubernetes', 'security', 'cloud architecture', 'leadership', 'azure']",,,,,,,,,,,,,,,,,
167,senior devops architect,leads devops initiatives at an architectural level by designing ci cd pipelines and promoting automation across development teams,"['aws', 'ansible', 'google cloud', 'docker', 'automation', 'kubernetes', 'security', 'networking', 'cloud computing', 'leadership', 'terraform', 'azure']",,,,,,,,,,,,,,,,,
168,senior devsecops architect,integrates security into devops practices at an architectural level by designing secure ci cd pipelines and implementing security best practices,"['ansible', 'docker', 'devsecops', 'kubernetes', 'vulnerability management', 'security automation', 'leadership', 'terraform', 'cloud security']",,,,,,,,,,,,,,,,,
169,senior sre architect,leads sre efforts at an architectural level by designing scalable reliable systems while improving incident response strategies,"['devops', 'docker', 'monitoring', 'automation', 'kubernetes', 'python', 'networking', 'sre', 'leadership', 'linux', 'cloud platforms']",,,,,,,,,,,,,,,,,
