job_id,job_title,job_description_clean,skills,salary_usd,salary_currency,experience_level,employment_type,company_location,company_size,employee_residence,remote_ratio,required_skills,education_required,years_experience,industry,posting_date,application_deadline,job_description_length,benefits_score,company_name
170,senior sre engineer,drives site reliability efforts by implementing monitoring solutions and automating incident response responsible for improving service availability,"['devops', 'docker', 'monitoring', 'automation', 'kubernetes', 'python', 'networking', 'sre', 'leadership', 'linux', 'cloud platforms']",,,,,,,,,,,,,,,,,
171,sharepoint developer,develops applications on sharepoint platform using technologies like net and javascript responsibilities include customizing sharepoint sites and building web parts,"['.net', 'sharepoint', 'javascript', 'sharepoint framework', 'rest apis', 'powershell']",,,,,,,,,,,,,,,,,
172,software developer,develops software applications based on specifications provided by stakeholders responsibilities include coding testing debugging and collaborating on projects,"['python', 'c++', 'data structures', 'java', 'debugging', 'programming', 'algorithms', 'software development']",,,,,,,,,,,,,,,,,
173,software engineer,designs develops and tests software applications to meet business needs requires strong problem solving skills and knowledge of software development methodologies,"['python', 'c++', 'data structures', 'java', 'software design', 'jenkins', 'git', 'cloud computing', 'algorithms']",,,,,,,,,,,,,,,,,
174,sonarqube engineer,manages sonarqube instance to measure track code quality responsible for configuring quality profiles gates while providing feedback to development teams,"['.net', 'sonarqube', 'security', 'static code analysis', 'java', 'code quality']",,,,,,,,,,,,,,,,,
175,splunk enterprise security engineer,manages splunk enterprise security environment to detect respond to security incidents requires expertise in threat detection techniques,"['splunk enterprise security', 'incident response', 'threat detection', 'security analysis']",,,,,,,,,,,,,,,,,
176,sql developer,writes sql code for database applications responsibilities include creating stored procedures optimizing queries and designing database schemas,"['ssis', 'etl', 'database', 'data modeling', 'performance tuning', 'ssrs']",,,,,,,,,,,,,,,,,
177,sre architect,designs site reliability engineering strategies to improve system reliability while reducing operational overheads through automation,"['docker', 'monitoring', 'automation', 'kubernetes', 'cloud architecture', 'networking', 'sre', 'incident management']",,,,,,,,,,,,,,,,,
178,sre engineer,implements site reliability engineering practices by monitoring systems responding to incidents and automating operational tasks,"['devops', 'docker', 'monitoring', 'automation', 'kubernetes', 'python', 'sre', 'linux', 'cloud platforms']",,,,,,,,,,,,,,,,,
179,systems administrator,manages computer systems within an organization responsibilities include configuring servers troubleshooting issues and ensuring system security,"['troubleshooting', 'networking', 'windows server administration', 'virtualization', 'linux administration', 'scripting']",,,,,,,,,,,,,,,,,
180,systems engineer,designs and implements it systems that meet business requirements responsibilities include system integration testing and deployment,"['networking', 'cloud computing', 'windows server administration', 'systems design', 'linux administration']",,,,,,,,,,,,,,,,,
181,teamcity engineer,manages teamcity ci cd server by configuring build configurations pipelines and integrating with source control systems,"['teamcity', 'version control', 'build automation', 'git']",,,,,,,,,,,,,,,,,
182,tech sales engineer,supports sales efforts by providing technical expertise during presentations demonstrations while answering questions about technical aspects,"['product knowledge', 'networking technologies', 'technical sales', 'customer engagement']",,,,,,,,,,,,,,,,,
183,technical account manager,manages relationships with technical customers while providing support guidance on their technology needs acts as a liaison between customer engineering teams,"['project management', 'technical support', 'account management']",,,,,,,,,,,,,,,,,
184,technical lead,leads technical teams on projects by providing guidance mentorship while driving technical direction decisions within projects,"['project management', 'team leadership', 'agile methodologies']",,,,,,,,,,,,,,,,,
185,terraform engineer,writes terraform scripts to automate infrastructure provisioning across cloud platforms requires expertise in infrastructure as code iac practices,"['aws', 'terraform', 'azure', 'google cloud']",,,,,,,,,,,,,,,,,
186,tfs engineer,manages team foundation server tfs to support software development processes responsibilities include configuring build pipelines and managing version control,"['.net framework', '.net development tools']",,,,,,,,,,,,,,,,,
187,udeploy engineer,manages deployment processes using urbancode deploy responsibilities include configuring deployment projects and automating release workflows,"['automation', 'version control', 'udeploy (urbancode deploy)', 'deployment strategies']",,,,,,,,,,,,,,,,,
188,ui designer,designs user interfaces that are visually appealing while intuitive to use responsibilities include creating mockups prototypes and conducting user research,"['prototyping', 'ui design principles', 'adobe creative suite', 'figma', 'user testing', 'wireframing']",,,,,,,,,,,,,,,,,
189,ui developer,develops user interfaces using html5 css3 javascript while focusing on responsive design principles collaborates with ui designers to implement designs,"['css', 'responsive design', 'javascript', 'react', 'jquery', 'html', 'angular']",,,,,,,,,,,,,,,,,
190,unity developer,develops interactive content with unity engine including 3d simulations while working with assets created by graphic designers,"['3d modeling', 'animation', 'unity3d engine', 'game development principles']",,,,,,,,,,,,,,,,,
191,ux designer,conducts user research studies to gather insights on user behavior create wireframes mockups based on data collected from research initiatives,"['user research', 'usability testing', 'interaction design', 'prototyping', 'wireframing']",,,,,,,,,,,,,,,,,
192,vault engineer,implement secret management to the cloud application,"['secrets management', 'hashicorp vault', 'encryption', 'access control', 'cloud security']",,,,,,,,,,,,,,,,,
193,web designer (ui/ux designer),create front end web application using html css js,"['prototyping', 'adobe creative suite', 'figma', 'ux design', 'wireframing']",,,,,,,,,,,,,,,,,
194,web developer,develops and maintains websites and web applications responsibilities include writing code debugging and ensuring optimal performance across different browsers and devices,"['css', 'node.js', 'javascript', 'react', 'html', 'php', 'angular']",,,,,,,,,,,,,,,,,
195,wordpress developer,creates and customizes wordpress websites responsibilities include developing themes plugins managing content and ensuring website functionality,"['css', 'javascript', 'html', 'database', 'wordpress', 'php']",,,,,,,,,,,,,,,,,
196,xl deploy engineer,manages deployment processes using xl deploy responsibilities include configuring deployment pipelines automating releases and ensuring application availability,"['deployment automation', 'xl deploy', 'version control']",,,,,,,,,,,,,,,,,
197,zabbix engineer,implements zabbix monitoring solutions to track system performance and availability responsible for configuring alerts dashboards and monitoring metrics,"['monitoring tools', 'zabbix', 'network monitoring', 'alerting systems']",,,,,,,,,,,,,,,,,
198,site reliability engineer (kubernetes ãâ¬ã¯â¿â½ docker),ensures the reliability and performance of systems running on kubernetes and docker,"['docker', 'monitoring', 'system reliability', 'automation', 'kubernetes']",,,,,,,,,,,,,,,,,
199,api developer,develops and implements apis for integrating systems and applications,"['restful services', 'api design', 'programming languages', 'security']",,,,,,,,,,,,,,,,,
200,automation specialist,designs and implements automation solutions to improve efficiency and reduce manual effort,"['process improvement', 'automation tools', 'testing', 'scripting']",,,,,,,,,,,,,,,,,
201,business intelligence analyst,analyzes data to provide insights and support business decision making,"['business acumen', 'data visualization', 'database', 'data analysis']",,,,,,,,,,,,,,,,,
202,cloud migration specialist,plans and executes cloud migration projects ensuring smooth transitions,"['project management', 'system migration', 'migration tools', 'cloud platforms']",,,,,,,,,,,,,,,,,
203,cybersecurity analyst,protects computer systems and networks from cyber threats,"['compliance', 'security protocols', 'incident response', 'threat analysis']",,,,,,,,,,,,,,,,,
204,data quality engineer,ensures data quality by profiling monitoring and improving data accuracy and consistency,"['data profiling', 'data quality tools', 'data governance', 'database']",,,,,,,,,,,,,,,,,
205,digital transformation consultant,advises organizations on digital transformation initiatives driving innovation and efficiency,"['digital strategy', 'technology consulting', 'change management', 'business process improvement']",,,,,,,,,,,,,,,,,
206,e-commerce developer,develops and maintains e commerce websites and applications,"['payment gateways', 'web development', 'e-commerce platforms', 'security']",,,,,,,,,,,,,,,,,
207,embedded systems engineer,develops software for embedded systems integrating hardware and software components,"['hardware interfaces', 'embedded systems', 'c++', 'firmware development']",,,,,,,,,,,,,,,,,
208,erp consultant,consults on erp system implementation customization and support,"['implementation', 'training', 'erp systems', 'business process analysis']",,,,,,,,,,,,,,,,,
209,geographic information systems (gis) analyst,analyzes spatial data using gis software to create maps and provide insights,"['gis software', 'cartography', 'data visualization', 'spatial analysis']",,,,,,,,,,,,,,,,,
210,help desk technician,provides technical support to end users resolving hardware and software issues,"['troubleshooting', 'customer service', 'technical support', 'hardware', 'software']",,,,,,,,,,,,,,,,,
211,identity and access management specialist,manages identity and access control systems ensuring secure access to resources,"['iam systems', 'authentication', 'authorization', 'security protocols']",,,,,,,,,,,,,,,,,
212,infrastructure architect,designs and plans it infrastructure ensuring scalability reliability and security,"['cloud computing', 'networking', 'system architecture', 'security']",,,,,,,,,,,,,,,,,
213,internet of things (iot) developer,develops applications for iot devices and platforms connecting devices and analyzing data,"['iot platforms', 'sensor technology', 'embedded systems', 'programming languages']",,,,,,,,,,,,,,,,,
214,it auditor,conducts it audits to ensure compliance and identify security risks,"['compliance', 'it auditing', 'security', 'risk management']",,,,,,,,,,,,,,,,,
215,java architect,designs and leads the development of java based systems ensuring scalability and maintainability,"['design patterns', 'cloud computing', 'system architecture', 'java']",,,,,,,,,,,,,,,,,
216,linux administrator,manages and maintains linux servers ensuring system stability and security,"['linux servers', 'troubleshooting', 'system administration', 'scripting']",,,,,,,,,,,,,,,,,
217,mainframe developer,develops and maintains applications on mainframe systems,"['mainframe systems', 'cobol', 'jcl', 'vsam']",,,,,,,,,,,,,,,,,
218,microsoft dynamics developer,develops and customizes microsoft dynamics crm solutions,"['crm', 'microsoft dynamics', '.net', 'development']",,,,,,,,,,,,,,,,,
219,mobile security specialist,ensures the security of mobile devices and applications conducting assessments and implementing security measures,"['penetration testing', 'mobile security', 'security protocols', 'risk management']",,,,,,,,,,,,,,,,,
220,natural language processing engineer,develops nlp models for various applications such as chatbots and text analysis tools,"['nlp algorithms', 'text analysis', 'python', 'machine learning']",,,,,,,,,,,,,,,,,
221,network architect,designs and plans computer networks,"['system architecture', 'network design', 'security', 'network protocols']",,,,,,,,,,,,,,,,,
222,penetration tester,conducts penetration tests to identify security vulnerabilities in systems and applications,"['vulnerability assessment', 'ethical hacking', 'security audits', 'penetration testing']",,,,,,,,,,,,,,,,,
223,python architect,designs and leads the development of python based systems ensuring scalability and maintainability,"['cloud computing', 'design patterns', 'python', 'system architecture']",,,,,,,,,,,,,,,,,
224,quality assurance manager,manages quality assurance processes ensuring software quality through testing and automation,"['test planning', 'test automation', 'team leadership', 'qa processes']",,,,,,,,,,,,,,,,,
225,release manager,manages software releases coordinating activities and ensuring smooth deployments,"['cd pipelines', 'communication', 'release management', 'coordination']",,,,,,,,,,,,,,,,,
226,sap consultant,consults on sap system implementation customization and support,"['sap modules', 'customization', 'implementation', 'business process analysis']",,,,,,,,,,,,,,,,,
227,ux/ui designer,designs user interfaces and experiences ensuring usability and aesthetic appeal,"['user research', 'prototyping', 'ui design', 'usability testing']",,,,,,,,,,,,,,,,,
228,back end developer,develops the server side logic and apis for web applications,"['server-side programming', 'api development', 'frameworks', 'database']",,,,,,,,,,,,,,,,,
229,web designer,creates visual designs and layouts for websites ensuring aesthetic appeal and usability,"['wireframing', 'graphic design', 'ux principles', 'web design']",,,,,,,,,,,,,,,,,
230,web engineer,designs and implements web infrastructure ensuring scalability and reliability,"['web technologies', 'security', 'performance optimization', 'system architecture']",,,,,,,,,,,,,,,,,
231,web producer,manages the creation and delivery of web content coordinating with stakeholders,"['project management', 'content strategy', 'web content management', 'collaboration']",,,,,,,,,,,,,,,,,
232,web project manager,manages web development projects ensuring they are completed on time and within budget,"['project management', 'web development', 'communication', 'budgeting']",,,,,,,,,,,,,,,,,
233,web content manager,manages web content ensuring it is accurate engaging and optimized for search engines,"['content strategy', 'seo', 'content creation', 'cms']",,,,,,,,,,,,,,,,,
234,multimedia architect,designs and produces multimedia content for various platforms,"['video production', 'multimedia design', 'audio production', 'graphic design']",,,,,,,,,,,,,,,,,
235,web analytics developer,implements web analytics tools and analyzes data to improve website performance,"['web analytics tools', 'reporting', 'b testing', 'data analysis']",,,,,,,,,,,,,,,,,
236,seo consultant,advises on seo strategies improving website visibility and organic traffic,"['link building', 'keyword research', 'content optimization', 'search engine optimization']",,,,,,,,,,,,,,,,,
237,seo manager,manages seo initiatives leading teams and monitoring performance,"['team leadership', 'reporting', 'seo strategy', 'performance monitoring']",,,,,,,,,,,,,,,,,
238,internet engineer,designs implements and manages internet infrastructure,"['networking protocols', 'internet technologies', 'security', 'system administration']",,,,,,,,,,,,,,,,,
239,front-end designer,designs the visual elements and user interface of web applications,"['css', 'responsive design', 'javascript', 'html', 'ux design']",,,,,,,,,,,,,,,,,
240,mobile developer,develops mobile applications for ios and android platforms,"['ios', 'ux design', 'android sdks', 'mobile app development', 'programming languages']",,,,,,,,,,,,,,,,,
241,power bi developer,develops interactive dashboards and reports using power bi,"['power bi', 'dax', 'data visualization', 'data modeling']",,,,,,,,,,,,,,,,,
242,power bi analyst,analyzes data using power bi to provide insights and support business decision making,"['business intelligence', 'power bi', 'database', 'data analysis']",,,,,,,,,,,,,,,,,
243,cloud computing specialist,manages and maintains cloud infrastructure ensuring availability and performance,"['virtualization', 'cloud platforms', 'system administration', 'security']",,,,,,,,,,,,,,,,,
244,cybersecurity specialist,protects computer systems and networks from cyber threats,"['compliance', 'security protocols', 'incident response', 'threat analysis']",,,,,,,,,,,,,,,,,
245,data science specialist,applies data science techniques to analyze data and solve business problems,"['statistical modeling', 'data visualization', 'machine learning', 'data analysis']",,,,,,,,,,,,,,,,,
246,artificial intelligence engineer,develops ai models and applications implementing machine learning algorithms,"['neural networks', 'ml algorithms', 'python', 'deep learning']",,,,,,,,,,,,,,,,,
247,database architect,designs and manages database systems ensuring data integrity and performance,"['performance tuning', 'database', 'data modeling']",,,,,,,,,,,,,,,,,
248,software architect,designs and leads the development of software systems ensuring scalability and maintainability,"['programming languages', 'design patterns', 'cloud computing', 'system architecture']",,,,,,,,,,,,,,,,,
249,cybersecurity engineer,implements and manages security measures to protect computer systems and networks,"['risk management', 'security protocols', 'incident response', 'threat analysis']",,,,,,,,,,,,,,,,,
250,infosec analyst/cybersecurity analyst,protects computer systems and networks from cyber threats,"['compliance', 'security protocols', 'incident response', 'threat analysis']",,,,,,,,,,,,,,,,,
251,computer forensic analyst,investigates cybercrimes and security incidents collecting and analyzing digital evidence,"['legal compliance', 'data recovery', 'digital forensics', 'incident response']",,,,,,,,,,,,,,,,,
252,it security specialist,implements and manages security measures to protect computer systems and networks,"['compliance', 'risk management', 'security protocols', 'threat analysis']",,,,,,,,,,,,,,,,,
253,security manager,manages security teams and initiatives ensuring the protection of it assets,"['risk assessment', 'security management', 'compliance', 'team leadership']",,,,,,,,,,,,,,,,,
254,security engineer,implements and manages security measures to protect computer systems and networks,"['risk management', 'security protocols', 'incident response', 'threat analysis']",,,,,,,,,,,,,,,,,
255,security consultant,provides security consulting services assessing risks and recommending security solutions,"['risk assessment', 'compliance', 'security solutions', 'security consulting']",,,,,,,,,,,,,,,,,
256,director of security,leads security teams and initiatives providing strategic direction and ensuring compliance,"['compliance', 'security leadership', 'incident response', 'risk management']",,,,,,,,,,,,,,,,,
257,security administrator,administers security systems managing user access and enforcing security policies,"['security policies', 'system administration', 'user management', 'security tools']",,,,,,,,,,,,,,,,,
258,chief information officer,leads it organizations defining it strategy and overseeing it operations,"['project management', 'it strategy', 'budgeting', 'leadership']",,,,,,,,,,,,,,,,,
259,network security engineer,implements and manages network security measures protecting networks from threats,"['networking protocols', 'security protocols', 'intrusion detection', 'firewall management']",,,,,,,,,,,,,,,,,
260,machine learning engineer for cybersecurity,develops machine learning models for cybersecurity applications such as threat detection and fraud prevention,"['cybersecurity', 'machine learning', 'threat detection', 'data analysis']",,,,,,,,,,,,,,,,,
261,network analyst,monitors network performance troubleshoots issues and provides performance reports,"['reporting', 'network monitoring', 'troubleshooting', 'performance analysis']",,,,,,,,,,,,,,,,,
262,network operations engineer,manages day to day network operations resolving issues and ensuring network availability,"['incident response', 'network operations', 'troubleshooting', 'monitoring']",,,,,,,,,,,,,,,,,
263,network reliability engineer,ensures the reliability and performance of network infrastructure implementing automation and monitoring solutions,"['automation', 'network reliability', 'incident response', 'monitoring']",,,,,,,,,,,,,,,,,
264,network infrastructure specialist,installs configures and maintains network infrastructure including cabling and hardware,"['cabling', 'network design', 'implementation', 'networking hardware']",,,,,,,,,,,,,,,,,
265,computer support specialist,provides technical support to end users resolving hardware and software issues,"['troubleshooting', 'customer service', 'technical support', 'hardware', 'software']",,,,,,,,,,,,,,,,,
266,information technology analyst,analyzes it systems and processes recommending improvements and providing it consulting services,"['process improvement', 'it analysis', 'it consulting', 'requirements gathering']",,,,,,,,,,,,,,,,,
267,technology sales consultant,sells technology solutions providing technical expertise and building customer relationships,"['technical expertise', 'customer relationship management', 'technology solutions', 'sales']",,,,,,,,,,,,,,,,,
268,database developer,develops database applications and schemas,"['database', 'data modeling']",,,,,,,,,,,,,,,,,
269,database analyst,analyzes data stored in databases and creates reports,"['reporting', 'data modeling', 'database', 'data analysis']",,,,,,,,,,,,,,,,,
270,data warehouse manager,manages data warehouse projects and teams,"['data warehousing', 'etl processes', 'team leadership', 'data modeling']",,,,,,,,,,,,,,,,,
271,data warehouse programming specialist,develops and maintains etl processes for data warehousing,"['data warehousing', 'etl processes', 'database', 'data modeling']",,,,,,,,,,,,,,,,,
272,intelligence specialist,gathers and analyzes intelligence data to support security and decision making,"['reporting', 'security', 'intelligence gathering', 'data analysis']",,,,,,,,,,,,,,,,,
273,cloud/software architect,designs and oversees the implementation of cloud computing strategies,"['devops', 'cloud platforms', 'system architecture', 'cloud security']",,,,,,,,,,,,,,,,,
274,cloud/software developer,develops software applications on cloud platforms,"['cloud services', 'cloud platforms', 'software development', 'programming languages']",,,,,,,,,,,,,,,,,
275,cloud/software applications engineer,develops and deploys applications on cloud platforms,"['cloud services', 'devops', 'cloud platforms', 'application development']",,,,,,,,,,,,,,,,,
276,cloud system administrator,manages and maintains cloud infrastructure ensuring availability and performance,"['virtualization', 'cloud platforms', 'system administration', 'networking']",,,,,,,,,,,,,,,,,
277,cloud system engineer,engineers cloud infrastructure implementing automation and ensuring system reliability,"['automation', 'cloud platforms', 'scripting', 'system engineering']",,,,,,,,,,,,,,,,,
278,platform engineer,develops and maintains platform infrastructure enabling efficient software development and deployment,"['automation', 'devops practices', 'cloud computing', 'platform engineering']",,,,,,,,,,,,,,,,,
279,software quality assurance analyst,ensures software quality through testing and reporting,"['test planning', 'reporting', 'test execution', 'qa processes']",,,,,,,,,,,,,,,,,
280,ui (user interface) designer,designs user interfaces ensuring usability and aesthetic appeal,"['user research', 'prototyping', 'ui design', 'usability testing']",,,,,,,,,,,,,,,,,
281,it sales executive,sells technology solutions developing sales strategies and building customer relationships,"['sales strategy', 'customer relationship management', 'technology solutions', 'sales']",,,,,,,,,,,,,,,,,
282,it sales director,leads it sales teams developing sales strategies and managing customer relationships,"['sales strategy', 'customer relationship management', 'team management', 'sales leadership']",,,,,,,,,,,,,,,,,
283,technology manager,manages it teams and projects ensuring efficient operations,"['project management', 'team leadership', 'budgeting', 'it management']",,,,,,,,,,,,,,,,,
284,technology assistant,provides technical and administrative support to it teams,"['administrative support', 'troubleshooting', 'technical support', 'hardware', 'software']",,,,,,,,,,,,,,,,,
285,technology specialist,provides technical expertise and support resolving complex it issues,"['technical expertise', 'problem solving', 'it support', 'troubleshooting']",,,,,,,,,,,,,,,,,
286,director oracle,manages oracle database teams and projects ensuring efficient operations,"['project management', 'team leadership', 'budgeting', 'database']",,,,,,,,,,,,,,,,,
287,knowledge manager,manages knowledge assets ensuring information is accessible and organized,"['documentation', 'knowledge management', 'collaboration', 'information architecture']",,,,,,,,,,,,,,,,,
288,manager hardware,manages hardware resources leading teams and overseeing hardware operations,"['hardware management', 'team leadership', 'budgeting', 'inventory management']",,,,,,,,,,,,,,,,,
