job_id,job_title,job_description_clean,skills,salary_usd,salary_currency,experience_level,employment_type,company_location,company_size,employee_residence,remote_ratio,required_skills,education_required,years_experience,industry,posting_date,application_deadline,job_description_length,benefits_score,company_name
1,admin big data,responsible for managing and overseeing big data infrastructure ensuring data integrity security and availability requires expertise in hadoop spark and data warehousing solutions,"['aws', 'mapreduce', 'data governance', 'etl', 'spark', 'security', 'big data architecture', 'data warehousing', 'cloud computing', 'database', 'data modeling', 'hadoop', 'azure', 'data lakes']",,,,,,,,,,,,,,,,,
2,ansible operations engineer,focuses on automating it processes using ansible responsibilities include writing playbooks managing configurations and ensuring system reliability,"['ansible', 'aws', 'docker', 'automation', 'kubernetes', 'python', 'networking', 'infrastructure as code', 'linux', 'cloud platforms', 'scripting', 'terraform']",,,,,,,,,,,,,,,,,
3,artifactory administrator,manages the artifactory repository for build artifacts responsibilities include configuring repositories managing access permissions and integrating with ci cd pipelines,"['build automation', 'docker', 'version control', 'jfrog cli', 'maven', 'jenkins', 'git', 'cloud computing', 'gradle', 'linux', 'artifactory']",,,,,,,,,,,,,,,,,
4,artificial intelligence / machine learning leader,leads ai ml projects and teams defining strategy and overseeing implementation requires strong leadership skills and knowledge of ai technologies,"['budgeting', 'data science', 'stakeholder management', 'deep learning', 'project management', 'machine learning', 'cloud computing', 'team management', 'ai strategy', 'communication']",,,,,,,,,,,,,,,,,
5,artificial intelligence / machine learning sr.leader,senior role overseeing multiple ai ml initiatives responsible for strategic planning team management and ensuring alignment with business goals,"['budgeting', 'data science', 'stakeholder management', 'mentoring', 'deep learning', 'project management', 'innovation', 'machine learning', 'cloud computing', 'team management', 'ai strategy', 'communication']",,,,,,,,,,,,,,,,,
6,artificial intelligence architect,designs ai systems and architecture responsible for selecting appropriate technologies ensuring scalability and integrating ai solutions into existing systems,"['aws', 'scalability', 'system design', 'data science', 'security', 'deep learning', 'ai architecture', 'cloud computing', 'machine learning', 'model deployment', 'azure']",,,,,,,,,,,,,,,,,
7,artificial intelligence researcher,conducts research in ai to develop new algorithms and models publishes findings in scientific journals and collaborates with academic institutions,"['scientific writing', 'statistical analysis', 'python', 'tensorflow', 'research methods', 'deep learning', 'data analysis', 'pytorch', 'machine learning', 'algorithm design']",,,,,,,,,,,,,,,,,
8,big data architect,designs big data solutions and architecture responsible for data modeling etl processes and ensuring the performance of big data systems,"['aws', 'mapreduce', 'kafka', 'data governance', 'etl', 'spark', 'security', 'data warehousing', 'cloud computing', 'database', 'data modeling', 'hadoop', 'azure', 'data lakes']",,,,,,,,,,,,,,,,,
9,big data engineer,builds and maintains big data pipelines responsible for data ingestion transformation and storage using technologies like hadoop and spark,"['data pipelines', 'kafka', 'etl', 'spark', 'scala', 'python', 'java', 'data warehousing', 'cloud computing', 'database', 'hadoop']",,,,,,,,,,,,,,,,,
10,big data specialist,analyzes large datasets to extract insights requires knowledge of statistical analysis tools and big data technologies,"['statistical analysis', 'etl', 'spark', 'data modeling', 'data analysis', 'cloud computing', 'database', 'data visualization', 'hadoop', 'data mining']",,,,,,,,,,,,,,,,,
11,build and release engineer,manages the build process for software applications responsible for automating builds managing release schedules and ensuring software quality,"['docker', 'build tools', 'maven', 'automation', 'kubernetes', 'jenkins', 'git', 'gradle', 'linux', 'scripting']",,,,,,,,,,,,,,,,,
12,build engineer,focuses on building software applications from source code responsibilities include configuring build environments and troubleshooting build issues,"['ant', 'build automation', 'version control', 'maven', 'jenkins', 'git', 'gradle', 'linux', 'scripting']",,,,,,,,,,,,,,,,,
13,chef operations engineer,utilizes chef for configuration management responsible for writing cookbooks managing infrastructure as code and automating deployment processes,"['aws', 'automation', 'chef', 'infrastructure as code', 'cloud computing', 'linux', 'azure', 'ruby', 'configuration management']",,,,,,,,,,,,,,,,,
14,data analysts,analyzes datasets to provide actionable insights requires proficiency in sql excel and data visualization tools like tableau or power bi,"['data cleansing', 'tableau', 'etl', 'power bi', 'excel', 'python', 'database', 'data modeling', 'statistics', 'data visualization', 'data mining']",,,,,,,,,,,,,,,,,
15,data architect,designs data models and architecture for databases responsible for ensuring data quality integrity and security across systems,"['aws', 'data governance', 'etl', 'data security', 'data warehousing', 'cloud computing', 'database', 'data modeling', 'azure', 'data integration']",,,,,,,,,,,,,,,,,
16,devops architect,designs devops frameworks that enhance collaboration between development operations teams while implementing ci cd practices,"['aws', 'ansible', 'google cloud', 'docker', 'automation', 'kubernetes', 'security', 'networking', 'cloud computing', 'terraform', 'azure']",,,,,,,,,,,,,,,,,
17,devops engineer,implements devops practices by automating software delivery processes using tools like jenkins or gitlab ci,"['aws', 'ansible', 'docker', 'automation', 'kubernetes', 'jenkins', 'networking', 'python', 'git', 'cloud computing', 'linux', 'azure', 'scripting', 'terraform']",,,,,,,,,,,,,,,,,
18,elk engineer,implements elk stack elasticsearch logstash kibana solutions for log management analysis while creating visualizations dashboards,"['elasticsearch', 'aws', 'kibana', 'logstash', 'log management', 'networking', 'security', 'linux', 'data visualization', 'azure']",,,,,,,,,,,,,,,,,
19,gerrit administrator,administers gerrit code review tool responsibilities include managing user access configuring project settings and facilitating code reviews,"['version control', 'automation', 'code review', 'git', 'gerrit', 'linux', 'scripting']",,,,,,,,,,,,,,,,,
20,jenkins engineer,manages jenkins ci cd server to automate software builds deployments responsibilities include configuring jobs plugins and maintaining build pipelines,"['build automation', 'docker', 'version control', 'automation', 'kubernetes', 'jenkins', 'groovy', 'linux', 'scripting']",,,,,,,,,,,,,,,,,
21,jira administrator,manages jira project management tool responsibilities include configuring workflows managing user permissions and supporting teams in agile methodologies,"['agile methodologies', 'jira', 'project management', 'workflow configuration', 'user management', 'atlassian suite']",,,,,,,,,,,,,,,,,
22,kubernetes operations engineer,manages kubernetes clusters for container orchestration responsibilities include deploying applications monitoring cluster health and troubleshooting issues,"['aws', 'docker', 'automation', 'kubernetes', 'security', 'networking', 'cloud computing', 'linux', 'azure']",,,,,,,,,,,,,,,,,
23,machine learning architect,designs machine learning systems architecture responsible for selecting appropriate frameworks designing workflows and ensuring scalability of ml models,"['aws', 'scalability', 'system design', 'data science', 'security', 'deep learning', 'cloud computing', 'machine learning', 'model deployment', 'azure']",,,,,,,,,,,,,,,,,
24,machine learning engineer,builds machine learning models by implementing algorithms data processing techniques while focusing on model evaluation deployment,"['natural language processing', 'computer vision', 'data science', 'python', 'tensorflow', 'data analysis', 'deep learning', 'pytorch', 'machine learning', 'keras', 'algorithms']",,,,,,,,,,,,,,,,,
25,operations engineer,oversees it operations to ensure system reliability responsibilities include monitoring system performance troubleshooting issues and implementing improvements,"['troubleshooting', 'monitoring', 'system administration', 'automation', 'networking', 'windows server', 'cloud computing', 'linux', 'scripting']",,,,,,,,,,,,,,,,,
26,principle engineer in artificial intelligence,leads ai initiatives within an organization responsibilities include strategic planning mentoring teams and driving innovation in ai technologies,"['system design', 'data science', 'python', 'tensorflow', 'mentoring', 'deep learning', 'innovation', 'machine learning', 'cloud computing', 'ai strategy']",,,,,,,,,,,,,,,,,
27,principle engineer in big data,senior role responsible for big data strategy implementation oversees architecture design decisions and ensures compliance with best practices,"['data governance', 'kafka', 'spark', 'big data architecture', 'mentoring', 'data warehousing', 'innovation', 'cloud computing', 'hadoop']",,,,,,,,,,,,,,,,,
28,principle engineer in data analysis,leads data analysis projects to derive insights from complex datasets requires strong analytical skills and experience with statistical methods,"['python', 'mentoring', 'data analysis', 'innovation', 'database', 'data modeling', 'statistics', 'data visualization']",,,,,,,,,,,,,,,,,
29,principle engineer in machine learning,senior role overseeing machine learning projects responsible for guiding teams on best practices in model development and deployment,"['python', 'tensorflow', 'mentoring', 'deep learning', 'innovation', 'cloud computing', 'machine learning', 'model deployment']",,,,,,,,,,,,,,,,,
30,production support engineer,provides support for production systems to ensure uptime responsibilities include monitoring applications troubleshooting issues and performing root cause analysis,"['troubleshooting', 'monitoring', 'automation', 'networking', 'windows server', 'database', 'itil', 'linux', 'scripting']",,,,,,,,,,,,,,,,,
31,puppet operations engineer,utilizes puppet for configuration management tasks responsible for writing manifests scripts to automate system configurations across environments,"['aws', 'automation', 'puppet', 'infrastructure as code', 'cloud computing', 'linux', 'azure', 'ruby', 'configuration management']",,,,,,,,,,,,,,,,,
32,senior build and release engineer,leads build release engineering efforts within an organization manages complex build environments while ensuring timely delivery of software releases,"['docker', 'build tools', 'maven', 'automation', 'kubernetes', 'jenkins', 'mentoring', 'git', 'leadership', 'gradle', 'linux', 'scripting']",,,,,,,,,,,,,,,,,
33,senior build engineer,oversees build processes for software projects at a senior level responsible for optimizing build times and maintaining build infrastructure,"['ant', 'build automation', 'version control', 'maven', 'jenkins', 'mentoring', 'git', 'leadership', 'gradle', 'linux', 'scripting']",,,,,,,,,,,,,,,,,
34,senior devops engineer,drives devops initiatives at a senior level responsibilities include mentoring team members and implementing automation strategies,"['aws', 'ansible', 'docker', 'automation', 'kubernetes', 'jenkins', 'networking', 'python', 'git', 'cloud computing', 'leadership', 'linux', 'azure', 'terraform']",,,,,,,,,,,,,,,,,
35,site reliability engineer (kubernetes â docker),focuses on maintaining high availability of containerized applications using kubernetes docker while implementing sre best practices,"['docker', 'troubleshooting', 'monitoring', 'automation', 'kubernetes', 'networking', 'sre', 'cloud computing', 'linux']",,,,,,,,,,,,,,,,,
36,splunk engineer,implements splunk solutions for log analysis security monitoring and operational intelligence responsible for creating dashboards alerts and managing data ingestion,"['aws', 'dashboards', 'log management', 'security', 'data analysis', 'linux', 'azure', 'splunk', 'alerting', 'scripting']",,,,,,,,,,,,,,,,,
37,.net developer,develops applications using net framework technologies including c responsibilities include application design development testing,"['.net', 'web api', 'mvc', 'entity framework', 'git', 'cloud computing', 'database', 'linq', 'asp.net']",,,,,,,,,,,,,,,,,
38,accessibility specialist,ensures digital content meets accessibility standards e g wcag conducts audits reviews to improve accessibility compliance,"['aria', 'css', 'javascript', 'ada compliance', 'html', 'wcag', 'accessibility testing', 'assistive technologies']",,,,,,,,,,,,,,,,,
39,agile project manager,manages agile projects by facilitating scrum ceremonies e g sprint planning ensures team adherence to agile principles methodologies,"['scrum', 'confluence', 'agile methodologies', 'stakeholder management', 'jira', 'project management', 'communication', 'kanban']",,,,,,,,,,,,,,,,,
40,android developer,develops mobile applications using android sdk java kotlin technologies while focusing on ui ux design principles,"['mobile development', 'android sdk', 'kotlin', 'java', 'android studio', 'rest apis', 'firebase', 'database', 'ux design']",,,,,,,,,,,,,,,,,
41,ansible automation engineer,automates it tasks using ansible playbooks scripts while managing configurations across environments,"['ansible', 'aws', 'automation', 'python', 'networking', 'infrastructure as code', 'cloud computing', 'linux', 'azure', 'scripting']",,,,,,,,,,,,,,,,,
42,appdynamics engineer,monitors application performance using appdynamics tools while providing insights into application health performance metrics,"['.net', 'troubleshooting', 'metrics', 'java', 'cloud computing', 'application performance monitoring', 'alerting', 'appdynamics']",,,,,,,,,,,,,,,,,
43,application security engineer,focuses on securing applications through vulnerability assessments pentesting while implementing security best practices,"['dast', 'secure coding', 'application security', 'owasp', 'vulnerability management', 'sast', 'penetration testing', 'cloud security']",,,,,,,,,,,,,,,,,
44,artifactory engineer,manages artifactory repositories while integrating them into ci cd pipelines to ensure efficient artifact management,"['build automation', 'docker', 'version control', 'maven', 'jenkins', 'git', 'cloud computing', 'gradle', 'linux', 'artifactory']",,,,,,,,,,,,,,,,,
45,aws devops engineer,implements devops practices on aws platform while utilizing services like ec2 s3 lambda to automate deployments,"['aws', 'devops', 'ansible', 'docker', 'automation', 'kubernetes', 'linux', 'terraform', 'cloudformation', 'scripting']",,,,,,,,,,,,,,,,,
46,aws solutions architect,designs scalable cloud architectures on aws platform while providing guidance on best practices security compliance,"['aws', 'devops', 'security', 'cloud architecture', 'networking', 'ec2', 'terraform', 'aws lambda', 'cloudformation', 'cloud security']",,,,,,,,,,,,,,,,,
47,azure devops engineer,implements devops solutions on azure platform while utilizing azure devops services tools to automate deployments,"['ansible', 'devops', 'docker', 'automation', 'kubernetes', 'linux', 'arm templates', 'terraform', 'azure', 'scripting']",,,,,,,,,,,,,,,,,
48,bamboo engineer,manages ci cd processes using bamboo responsibilities include configuring build plans integrating with version control systems and ensuring smooth deployment pipelines,"['build automation', 'version control', 'automation', 'atlassian suite', 'bamboo', 'git', 'scripting']",,,,,,,,,,,,,,,,,
49,bitbucket engineer,administers bitbucket repositories for version control responsible for managing user permissions branch strategies and pull requests,"['version control', 'bitbucket', 'code review', 'git', 'branching strategies', 'atlassian suite']",,,,,,,,,,,,,,,,,
50,blockchain developer,develops blockchain based applications and smart contracts requires knowledge of blockchain frameworks such as ethereum and programming languages like solidity,"['node.js', 'solidity', 'javascript', 'distributed ledger', 'consensus algorithms', 'web3', 'smart contracts', 'blockchain', 'cryptocurrency', 'ethereum']",,,,,,,,,,,,,,,,,
51,business systems analyst,analyzes business needs and translates them into technical requirements works closely with stakeholders to improve processes and implement technology solutions,"['process improvement', 'stakeholder management', 'data analysis', 'bpmn', 'database', 'business analysis', 'uml', 'requirements gathering']",,,,,,,,,,,,,,,,,
52,c# developer,develops applications using c and net technologies responsibilities include designing coding testing and debugging software applications,"['.net', 'web api', 'mvc', 'entity framework', 'git', 'cloud computing', 'database', 'linq', 'asp.net']",,,,,,,,,,,,,,,,,
53,chef inspec engineer,utilizes chef inspec for compliance automation responsible for writing tests to ensure systems meet security and compliance standards,"['automation', 'security', 'chef inspec', 'linux', 'cloud computing', 'compliance as code', 'configuration management']",,,,,,,,,,,,,,,,,
54,cloud administrator,no description available,"['aws', 'google cloud', 'automation', 'security', 'networking', 'cloud computing', 'virtualization', 'linux', 'azure', 'scripting']",,,,,,,,,,,,,,,,,
55,cloud architect,designs cloud architecture solutions to meet business requirements responsible for selecting appropriate cloud services and ensuring scalability security,"['aws', 'microservices', 'google cloud', 'docker', 'automation', 'kubernetes', 'cloud architecture', 'networking', 'terraform', 'azure', 'cloud security']",,,,,,,,,,,,,,,,,
56,cloud automation engineer,automates cloud infrastructure management using tools like terraform or ansible focuses on deploying resources efficiently across cloud environments,"['ansible', 'aws', 'google cloud', 'automation', 'python', 'cloud computing', 'terraform', 'azure', 'scripting']",,,,,,,,,,,,,,,,,
57,cloud engineer,builds and maintains cloud infrastructure responsibilities include configuring cloud services optimizing performance and ensuring security compliance,"['aws', 'google cloud', 'automation', 'security', 'networking', 'cloud computing', 'virtualization', 'linux', 'azure', 'scripting']",,,,,,,,,,,,,,,,,
58,cloud network engineer,designs and manages networking solutions within cloud environments focuses on vpcs subnets routing configurations and security groups,"['aws', 'routing', 'google cloud', 'subnets', 'cloud networking', 'security groups', 'firewalls', 'azure', 'vpc']",,,,,,,,,,,,,,,,,
59,cloud security engineer,implements security measures for cloud environments responsibilities include identity management data protection and compliance auditing,"['aws', 'gcp', 'compliance', 'vulnerability management', 'encryption', 'azure', 'iam', 'cloud security']",,,,,,,,,,,,,,,,,
60,cnc programmer,creates cnc programs for machining operations responsible for interpreting blueprints and optimizing tool paths for efficiency,"['toolpath optimization', 'cad', 'cam', 'machining', 'blueprints', 'g-code', 'manufacturing processes', 'cnc programming']",,,,,,,,,,,,,,,,,
61,coder,writes code in various programming languages to develop software applications responsibilities include debugging and maintaining code quality,"['data structures', 'problem solving', 'debugging', 'programming', 'algorithms', 'software development']",,,,,,,,,,,,,,,,,
62,computer graphics animator,creates animations using computer graphics software responsibilities include modeling rigging and rendering 3d assets,"['3d animation', 'maya', 'adobe creative suite', 'storyboarding', '2d animation', 'motion graphics', 'visual effects', 'blender']",,,,,,,,,,,,,,,,,
63,computer hardware engineer,designs and tests hardware components for computers responsibilities include circuit design prototyping and troubleshooting hardware issues,"['microprocessors', 'validation', 'circuit design', 'embedded systems', 'hardware design', 'testing', 'pcb design']",,,,,,,,,,,,,,,,,
64,computer network architect,designs network infrastructures to support organizational needs responsible for selecting hardware software solutions to optimize network performance,"['routing', 'tcp', 'lan', 'switching', 'network design', 'security', 'vpn', 'cloud networking', 'firewalls', 'wan']",,,,,,,,,,,,,,,,,
65,computer programmer,writes code to create software applications based on specifications responsibilities include debugging code and collaborating with other developers,"['python', 'c++', 'data structures', 'java', 'debugging', 'programming', 'algorithms', 'software development']",,,,,,,,,,,,,,,,,
66,computer research scientist,conducts research in computing fields to develop new technologies or methodologies publishes findings in academic journals and presents at conferences,"['scientific writing', 'data analysis', 'research methods', 'machine learning', 'programming', 'algorithms', 'publications']",,,,,,,,,,,,,,,,,
67,computer systems analyst,analyzes computer systems to identify improvements in efficiency or functionality works closely with stakeholders to gather requirements and implement solutions,"['process improvement', 'system analysis', 'stakeholder management', 'data analysis', 'database', 'uml', 'requirements gathering']",,,,,,,,,,,,,,,,,
68,confluence engineer,manages confluence as a collaboration tool within teams responsibilities include configuring spaces managing permissions and supporting documentation efforts,"['documentation', 'confluence', 'workflow configuration', 'collaboration', 'user management', 'atlassian suite']",,,,,,,,,,,,,,,,,
69,consul engineer,implements service discovery solutions using hashicorp consul responsible for configuring service mesh capabilities and ensuring application connectivity,"['consul', 'service discovery', 'automation', 'networking', 'cloud computing', 'configuration management']",,,,,,,,,,,,,,,,,
70,coverage.py engineer,utilizes coverage py for measuring code coverage in python applications responsible for implementing testing strategies to improve code quality,"['python', 'code coverage', 'quality assurance', 'coverage.py', 'testing']",,,,,,,,,,,,,,,,,
71,data analyst,analyzes data sets to extract insights that inform business decisions proficient in sql excel and data visualization tools like tableau or power bi,"['data cleansing', 'tableau', 'etl', 'power bi', 'excel', 'python', 'database', 'data modeling', 'statistics', 'data visualization', 'data mining']",,,,,,,,,,,,,,,,,
72,data engineer,builds data pipelines to support analytics initiatives requires expertise in etl processes sql databases and big data technologies,"['data pipelines', 'etl', 'spark', 'python', 'data warehousing', 'cloud computing', 'database', 'data modeling', 'hadoop']",,,,,,,,,,,,,,,,,
73,data modeler,creates data models that define how data is stored within databases works closely with architects to ensure alignment with business requirements,"['data governance', 'data warehousing', 'er diagrams', 'database', 'data modeling']",,,,,,,,,,,,,,,,,
74,data scientist,utilizes statistical analysis and machine learning techniques to derive insights from complex datasets proficient in programming languages like python or r,"['data wrangling', 'spark', 'data science', 'python', 'machine learning', 'cloud computing', 'database', 'data visualization', 'statistics', 'hadoop']",,,,,,,,,,,,,,,,,
75,database administrator,responsible for managing database systems including installation configuration monitoring performance backup recovery procedures,"['performance tuning', 'oracle', 'backup and recovery', 'database']",,,,,,,,,,,,,,,,,
76,datadog engineer,implements monitoring solutions using datadog to track application performance metrics responsible for configuring alerts dashboards,"['dashboards', 'troubleshooting', 'monitoring', 'metrics', 'datadog', 'cloud computing', 'linux', 'alerting']",,,,,,,,,,,,,,,,,
77,developer,writes software applications based on specifications provided by stakeholders collaborates with other developers on coding best practices,"['python', 'c++', 'data structures', 'java', 'debugging', 'programming', 'algorithms', 'software development']",,,,,,,,,,,,,,,,,
78,devops manager,oversees devops teams responsible for automating software delivery processes while ensuring alignment with organizational goals,"['devops', 'budgeting', 'automation', 'project management', 'cloud computing', 'leadership', 'team management', 'communication']",,,,,,,,,,,,,,,,,
79,devsecops architect,integrates security practices into the devops process by designing secure ci cd pipelines that meet compliance standards,"['ansible', 'docker', 'devsecops', 'kubernetes', 'vulnerability management', 'security automation', 'terraform', 'cloud security']",,,,,,,,,,,,,,,,,
80,devsecops engineer,implements security measures within the devops lifecycle by utilizing tools that automate security checks throughout development,"['aws', 'vulnerability scanning', 'docker', 'devsecops', 'kubernetes', 'continuous security', 'terraform', 'penetration testing', 'cloud security']",,,,,,,,,,,,,,,,,
81,director of engineering,leads engineering teams while overseeing project management efforts across multiple initiatives within the organization,"['budgeting', 'agile methodologies', 'project management', 'leadership', 'team management', 'communication', 'software development']",,,,,,,,,,,,,,,,,
